type,title,abstract,journal,author,year,keywords,filename,id,sens_acc,sens_gyr,sens_gps,sens_mic,sens_cam,perv_pill,perv_ecg,perv_wearable,ux_gui,ux_gesture,ux_voice,ux_text,ux_back,media_text,media_image,media_audio,media_video,media_anim,feat_use,feat_promp,feat_soc,feat_hcp,feat_learn,feat_prog,feat_ca,feat_ass,feat_vr,feat_ar,feat_pers,feat_game,anal_ml,anal_beh,anal_act,anal_sp,os_ios,os_and,app_name,geo_loc,md,md_id,md_desc,md_mul,md_sub,fmw_cbt,fmw_hum,fmw_sys,fmw_psy,fmw_wav,fmw_tra,fmw_pos,fmw_other,fmw_nk,val_ed,val_res,val_n,val_n2,val_ec,val_done,val_type,val_edrct,geo_ctry
InProceedings,Developing a smartphone application for the Life Enhancement Treatment for Substance Use (LETS act): Designing for motivation and feedback,"The Life Enhancement Treatment for Substance Use (LETS ACT) is a behavioral activation based treatment for comorbid depression and substance use (Daughters et al, 2008). We describe the iterative design process for including motivational and informational attributes in a smartphone application supporting treatment via LETS ACT and LETS ACT-SE (Daughters \& Chen, 2014). Design of the app was uniquely constrained by the need to meet clinical requirements while serving a special population of substance users. The primary goal of LETS ACT is to motivate the user to identify, engage in, and continue engaging in rewarding activities that align with their important life areas, goals, and values, and thus extend the effects of treatment sessions through self-management. In support of this primary goal, the goal of the app is to motivate the user to continue to use the application, and thus to adhere to the primary goal: self-management of treatment. In efficacy studies of LETS ACT and LETS ACT-SE, users could see their progress on paper (Daughters et al, 2008; Magidson et al, 2011) or on a web based platform. How to capitalize on the additional interactive affordances of a standalone smartphone application for this user group was unknown. The two challenges of providing information and motivation were at the core of the app design. Copyright 2015 Human Factors and Ergonomics Society.",NA,L.A. Matalenas and A.C. McLaughlin and Y. Chen and S.B. Daughters,2015,"Human engineering, Smartphones, Motivation, Signal encoding, Aluminum, Smart-phone applications, Self management, Ergonomics, User groups, Affordances, Iterative design, Substance use, Web based platform",086 - Developing a smartphone application,086,NO,NO,NO,NO,NO,NO,NO,NO,YES,NO,NO,NO,YES,YES,YES,NOT KNOWN,NO,NOT KNOWN,NO,YES,NO,NO,NOT KNOWN,YES,NO,NO,NO,NO,YES,NO,NO,NO,NO,NO,YES,NOT KNOWN,NA,NA,23-Comorbid disorders,23,Comorbid disorders,4-Depressive disorders; 16-Substance-related and addictive disorders,NA,NO,NO,NO,NO,YES,NO,NO,NO,NO,NA,NA,NA,not known,NA,NO,NO ASSESSMENT,NO,NA
Article,Development and feasibility of smartphone application for cognitive-behavioural case management of individuals with early psychosis.,"BACKGROUND: This article describes the development of the smartphone application for cognitive-behavioural case management of young individuals with early psychosis and examines the acceptance and potential clinical benefits of this application through a pilot survey.; METHODS: Gwangju Bukgu-Community Mental Health Center developed and launched a smartphone application (Heal Your Mind [HYM]) for cognitive-behavioural case management and symptom monitoring. The HYM application for clients includes 6 main modules including thought record, symptom record, daily life record, official notices, communication and scales. The key module is the {""}thought record{""} for self-directed cognitive-behavioural treatment. When the client writes and sends the self-cognitive-behavioural therapy sheet to the case manager, the latter receives a notification and can provide feedback in real time. We conducted a survey to investigate the acceptance and feasibility of this approach among young clients with early psychosis.; RESULTS: A total of 24 clients with early psychosis participated in this survey. More than 80\% of participants reported that it was easy to learn to use this application, and no one described this application as very complicated or reported that they needed a long time to learn how to use it. About 80\% of participants were satisfied with this application, and 70\% reported that they received help as a result of using this application.; CONCLUSIONS: This study suggests that this smartphone application is useful for young individuals with early psychosis and that it may contribute to the development of both young customer- and case manager-friendly systems for this clinical population. 2017 John Wiley \& Sons Australia, Ltd.",Early intervention in psychiatry,Sung-Wan Kim and Ga-Young Lee and Hye-Young Yu and Eun-I. Jung and Ju-Yeon Lee and Seon-Young Kim and Jae-Min Kim and Il-Seon Shin and Jin-Sang Yoon,2017,"schizophrenia, smartphone application, case management, cognitive-behavioural therapy, early psychosis",087 - Development and feasibility of smartphone,087,NO,NO,NO,NO,NO,NO,NO,NO,YES,NO,NO,NO,NOT KNOWN,YES,NO,NO,NO,NO,YES,YES,NO,YES,NO,YES,NO,NO,NO,NO,NO,NO,NO,NO,NO,NO,YES,YES,Heal Your Mind,Republic of Korea,2-Schizophrenia spectrum and other psychotic disorders,2,Schizophrenia spectrum and other psychotic disorders,NA,Early psychosis,YES,NO,NO,NO,NO,NO,NO,NO,NO,PILOT FEASIBILITY STUDY,"More than 80% of
participants reported that it was easy to learn to use this application, and no one described this
application as very complicated or reported that they needed a long time to learn how to use
it. About 80% of participants were satisfied with this application, and 70% reported that they
received help as a result of using this application.",24,NA,NA,YES,USABILITY/UX,NO,Republic of Korea
Article,Development and refinement of a clinician intervention to facilitate primary care patient use of the PTSD Coach app,"Posttraumatic stress disorder (PTSD) is common and undertreated among Veterans Affairs (VA) primary care patients. A brief primary care intervention combining clinician support with a self-management mobile app (Clinician-Supported PTSD Coach, CS-PTSD Coach) may improve patient outcomes. This study developed and refined an intervention to provide clinician support to facilitate use of the PTSD Coach app and gathered VA provider and patient qualitative and quantitative feedback on CS-PTSD Coach to investigate preliminary acceptability and implementation barriers/facilitators. VA primary care providers and mental health leadership (N = 9) completed a survey and interview regarding implementation barriers and facilitators structured according to the Consolidated Framework for Implementation Research (CFIR). Clinicians who delivered CS-PTSD Coach (N = 3) and patients (N = 9) who received it provided feedback on the intervention and implementation process. CS-PTSD Coach has high provider and patient acceptability. Important implementation factors included that CS-PTSD Coach be compatible with the clinicsâ€™ current practices, have low complexity to implement, be perceived to address patient needs, and have strong support from leadership. Diverse factors related to CS-PTSD Coach delivery facilitate implementation, provide an opportunity to problem-solve barriers, and improve integration of the intervention into primary care. 2016, Society of Behavioral Medicine (outside the US).",Translational Behavioral Medicine,K. Possemato and E. Kuhn and E.M. Johnson and J.E. Hoffman and E. Brooks,2017,"adult, Article, female, human, male, mobile application, priority journal, health care planning, patient care, primary health care, qualitative analysis, middle aged, treatment outcome, clinical practice, psychology, Adult, Female, Humans, Male, Middle Aged, procedures, feedback system, Mobile Applications, semi structured interview, physician, primary medical care, Primary Health Care, self care, utilization, Patient Acceptance of Health Care, patient attitude, Treatment Outcome, program acceptability, health care need, Self Care, posttraumatic stress disorder, Post-Traumatic, Stress Disorders, mentoring, Mentoring, constructive feedback, Formative Feedback, Industrial Development, industrialization, leadership, posttraumatic stress disorder coach application, veteran, Veterans",088 - Development and refinement of a clinician,088,NO,NO,NO,NO,NO,NO,NO,NO,YES,NO,NO,NO,NOT KNOWN,YES,YES,YES,NA,NOT KNOWN,NO,YES,NOT KNOWN,YES,YES,YES,NO,YES,NO,NO,YES,NO,NO,NO,NO,NO,YES,YES,PTSD Coach,United States of America,7-Trauma and stressor-related disorders,7,Trauma and stressor-related disorders,NA,Post-traumatic stress disorder,YES,NO,NO,NO,NO,NO,NO,NO,NO,PILOT STUDY,"CS-PTSD Coach has
high provider and patient acceptability. Important
implementation factors included that CS-PTSD Coach
be compatible with the clinics’ current practices,
have low complexity to implement, be perceived to
address patient needs, and have strong support
from leadership. Diverse factors related to CS-PTSD
Coach delivery facilitate implementation, provide an
opportunity to problem-solve barriers, and improve
integration of the intervention into primary care.",9,9 son los veteranos que dan feedback: Veteran feedback on CS-PTSD coach,NA,YES,USABILITY/UX,NO,United States of America
Article,Development and usability testing of FOCUS: A smartphone system for self-management of schizophrenia.,"Objective: Mobile Health (mHealth) approaches can support the rehabilitation of individuals with psychiatric conditions. In the current article, we describe the development of a smartphone illness self-management system for people with schizophrenia. Methods: The research was conducted with consumers and practitioners at a community-based rehabilitation agency. Stage 1: 904 individuals with schizophrenia or schizoaffective disorder completed a survey reporting on their current use of mobile devices and interest in mHealth services. Eight practitioners completed a survey examining their attitudes and expectations from an mHealth intervention, and identified needs and potential obstacles. Stage 2: A multidisciplinary team incorporated consumer and practitioner input and employed design principles for the development of e-resources for people with schizophrenia to produce an mHealth intervention. Stage 3: 12 consumers participated in laboratory usability sessions. They performed tasks involved in operating the new system, and provided â€œthink aloudâ€ commentary and post-session usability ratings. Results: 570 (63\%) of survey respondents reported owning a mobile device and many expressed interest in receiving mHealth services. Most practitioners believed that consumers could learn to use and would benefit from an mHealth intervention. In response, we developed a smartphone system that targets medication adherence, mood regulation, sleep, social functioning, and coping with symptoms. Usability testing revealed several design vulnerabilities, and the system was adapted to address consumer needs and preferences accordingly. Conclusions and Implications for Practice: Through a comprehensive development process, we produced an mHealth illness self-management intervention that is likely to be used successfully, and is ready for deployment and systemic evaluation in real-world conditions. (PsycINFO Database Record (c) 2016 APA, all rights reserved)",Psychiatric Rehabilitation Journal,Dror Ben-Zeev and Susan M. Kaiser and Christopher J. Brenner and Mark Begale and Jennifer Duffecy and David C. Mohr,2013,"Health, Mental Disorders, Intervention, Technology, Rehabilitation, *Telemedicine, *Cellular Phones, *Schizophrenia, *Self-Management",089 - Development and Usability Testing,089,NO,NO,NO,NO,NO,NO,NO,NO,YES,NO,NO,NO,NOT KNOWN,YES,NOT KNOWN,NOT KNOWN,NOT KNOWN,NOT KNOWN,NO,NOT KNOWN,NO,NO,NO,NOT KNOWN,NO,YES,NO,NO,NO,NO,NO,NO,NO,NO,NO,YES,FOCUS,Lebanon,2-Schizophrenia spectrum and other psychotic disorders,2,Schizophrenia spectrum and other psychotic disorders,NA,Schizophrenia or schizoaffective disorder,YES,NO,NO,NO,NO,NO,NO,NO,NO,PILOT?? 12 CONSUMERS PARTICIPATED IN LABORATORY USABILITY SESSIONS,"Overall, participants saw value in the FOCUS system, were confident they could use it for self-management of illness, and expressed interest in doing so given the opportunity. Usability testing revealed several design vulnerabilities, and the system was adapted to address consumer needs and preferences accordingly",12,12 son los que usan el sistema,NA,YES,USABILITY/UX,NO,Lebanon
Article,Development of a hybrid application for psychotic disorders self-management,"This paper describes iCOPE, a hybrid web/mobile application prototype with the purpose of improving the self-management of psychotic disorders. The development of iCOPE was driven by a multidisciplinary collaboration between mental health occupational therapists and medical computing engineers. A usability test was performed to assess the satisfaction with the technological proposal. Several modules were identified as crucial and were employed in iCOPE: stress management, problem solving, medication adherence, symptoms monitoring and social interaction. Results of a usability survey to therapists and patients revealed general approval of the user interfaces. Springer International Publishing AG 2017.",Advances in Intelligent Systems and Computing,R.S. {De Almeida} and C. Martins and A. Marques and D. Benevides and A. Costa and C. QueirÃ³s and T. Sousa and A. Almeida and N. Fonseca and L. Faria,2017,"Medical computing, Artificial intelligence, Application programs, Social interactions, Assistive technology, User interfaces, Ambient intelligence, Hybrid applications, Medication adherence, Multi-disciplinary collaborations, Psychotic disorders, Stress management, Usability",090 - Development of a Hybrid,090,NO,NO,NO,NO,NO,NO,NO,NO,YES,NO,NO,NO,NO,YES,NOT KNOWN,YES,YES,NO,NO,NO,NO,NO,YES,YES,NO,NO,NO,NO,NO,NO,NO,NO,NO,NO,NOT KNOWN,NOT KNOWN,iCOPE,NA,2-Schizophrenia spectrum and other psychotic disorders,2,Schizophrenia spectrum and other psychotic disorders,NA,NA,YES,NO,NO,NO,NO,NO,NO,NO,NO,USABILITY TEST,"Results of a usability survey
to therapists and patients revealed general approval of the user interfaces. both from the therapists and from the patients praised the
usability and usefulness of the implemented functionalities, and showed overall satisfaction
with the graphic features of the interfaces. However, users felt extra interface
customization, such as theming the application’s colours, which would be a visually
satisfying feature. Regarding therapy usefulness, patients understood most modules to
have good potential",6,"their designated
interfaces and to evaluate them. It is important to mention that patients and therapists
were paired up, which contributed to the lower amount of samples",NA,YES,USABILITY/UX,NO,NA
InProceedings,Development of a mobile application for people with panic disorder as augmentation for an internet-based intervention,"Smartphone technology has recently gained attention in the field of E-Mental Health research and mobile applications for measuring health-related aspects as well as mobile mental health interventions have emerged. However, little work has been done on leveraging mobile technology in combination with internet-based interventions. We argue, that mobile applications can not only enrich mental health treatments but also foster the commercial success of E-Mental Health applications. To this end, we have developed GET.ON PAPP, a mobile application for panic disorder that integrates an internet-based treatment into daily life. In this work, we present the development and structure of GET.ON PAPP and a perspective for its evaluation. 2013 Polish Information Processing Society.",NA,S.K. Stegemann and L. Ebenfeld and D. Lehr and M. Berking and B. Funk,2013,"Internet, Health, Computer applications, Mental health, Mobile applications, Information systems, Mobile computing, Mobile Technology, Computer science, Mental health treatments, Daily lives, Internet based, Health research, ITS evaluation",091 - Development of a Mobile Application for People,091,NO,NO,NO,NO,YES,NO,NO,NO,YES,NO,NO,NO,NO,YES,NOT KNOWN,NOT KNOWN,NOT KNOWN,NOT KNOWN,NO,NO,NO,NO,NOT KNOWN,YES,NO,NO,NO,NO,YES,NO,NO,NO,NO,NO,YES,YES,GET.ON PAPP,NA,5-Anxiety disorders,5,Anxiety disorders,NA,Panic disorder,YES,NO,NO,NO,NO,NO,NO,NO,NO,NA,NA,NA,NA,NA,NO,NO ASSESSMENT,NO,NA
Article,Development of a smartphone application for eating disorder self-monitoring,"ObjectiveThis case report aims to (1) describe the development and refinement of a smartphone application for eating disorder self-monitoring; (2) characterize its users in terms of demographic and clinical characteristics; and (3) explore its feasibility and utilization as a self-monitoring tool. MethodWe developed a mobile phone application through which people with eating disorders can self-monitor meals, emotions, behaviors, and thoughts. The application also included positive reinforcement, coping skill suggestions, social support, and feedback components. The app was made available on two Internet app stores. Data include number of downloads and subsequent usage statistics, consumer ratings on app-stores are used as indicators of satisfaction, anonymous aggregate demographic data and Eating Disorder Examination Questionnaire scores from 57,940 individuals collected over a two-year period. ResultsThe app demonstrated population-level utilization with over 100,000 users over a two-year period. Almost 50\% percent of users stated that they are not currently receiving clinical treatment and 33\% reported they had not told anyone about their eating disorder. A surprising number of people with severe problems are using the app. DiscussionSmartphone apps have the capacity to reach and engage traditionally underserved individuals with eating disorders at a large scale. Additional work is indicated for the evaluation of the clinical effectiveness of applications for specific user groups and in clinical treatment contexts. (c) 2015 Wiley Periodicals, Inc. (Int J Eat Disord 2015; 48:972-982)",INTERNATIONAL JOURNAL OF EATING DISORDERS,Jenna P. Tregarthen and James Lock and Alison M. Darcy,2015,"cognitive behavioral therapy, smartphone, mobile health, eating disorders, app",092 - Development of a Smartphone Application for Eating,092,NO,NO,NO,NO,NOT KNOWN,NO,NO,NO,YES,NO,NO,NO,YES,YES,YES,NOT KNOWN,NOT KNOWN,NOT KNOWN,YES,YES,YES,YES,YES,YES,NO,NOT KNOWN,NO,NO,YES,YES,NO,NO,NO,NO,YES,YES,Recovery Record,"United States of America, Palo Alto",10-Feeding and eating disorders,10,Feeding and eating disorders,NA,"Anorexia Nervosa, Underweight, Overweight, Obese",YES,NO,NO,NO,YES,NO,NO,NO,NO,CASE REPORT,"Two thousand five hundred and three anonymous
ratings were received over a two-year period.
Eighty-four percent of these ratings (n52,103)
were five out of five, 13.3% (n5333) rated the app
four out of five, 1.7% (n542) rated it three, and the
remaining 1% (n =25) rated it two out of five. There
were no ratings of 1.The app demonstrated
population-level utilization with over
100,000 users over a two-year period.
Almost 50% percent of users stated that
they are not currently receiving clinical
treatment and 33% reported they had
not told anyone about their eating disorder.
A surprising number of people with
severe problems are using the app. In addition to reaching individuals not engaged
in treatment, the app has potential to act as a support
tool to supplement clinical treatment.",NA,"In the 2 years since deployment of the first
Recovery Record prototype, 108,996 people downloaded
the patient application.",NA,YES,USABILITY/UX,NO,United States of America
Article,"Digital Cognitive Behavioural Therapy for Insomnia versus sleep hygiene education: the impact of improved sleep on functional health, quality of life and psychological well-being. Study protocol for a randomised controlled trial","Background: Previous research has demonstrated that digital CBT (dCBT), delivered via the Internet, is a scalable and effective intervention for treating insomnia in otherwise healthy adults and leads to significant improvements in primary outcomes relating to sleep. The majority of people with insomnia, however, seek help because of the functional impact and daytime consequences of poor sleep, not because of sleep discontinuity per se. Although some secondary analyses suggest that dCBT may have wider health benefits, no adequately powered study has investigated these as a primary endpoint. This study specifically aims to investigate the impact of dCBT for insomnia upon health and well-being, and will investigate sleep-related changes as mediating factors. Methods/design: We propose a pragmatic, parallel-group, randomised controlled trial of 1000 community participants meeting criteria for insomnia disorder. In the DIALS trial (Digital Insomnia therapy to Assist your Life as well as your Sleep), participants will be randomised to dCBT delivered using web and/or mobile channels (in addition to treatment as usual (TAU)) or to sleep hygiene education (SHE), comprising a website plus a downloadable booklet (in addition to TAU). Online assessments will take place at 0 (baseline), 4 (mid-treatment), 8 (post-treatment), and 24 (follow-up) weeks. At week 25 all participants allocated to SHE will be offered dCBT, at which point the controlled element of the trial will be complete. Naturalistic follow-up will be invited at weeks 36 and 48. Primary outcomes are functional health and well-being at 8 weeks. Secondary outcomes are mood, fatigue, sleepiness, cognitive function, productivity and social functioning. All main analyses will be carried out at the end of the final controlled follow-up assessments and will be based on the intention-to-treat principle. Further analyses will determine whether observed changes in functional health and well-being are mediated by changes in sleep. The trial is funded by Big Health Ltd. Discussion: This study will be the first large-scale, specifically designed investigation of the health and well-being benefits of CBT for insomnia, and the first examination of the association between CBT-mediated sleep improvement and health status.",TRIALS,Colin A. Espie and Annemarie I. Luik and John Cape and Christopher L. Drake and A. Niroshan Siriwardena and Jason C. Ong and Christopher Gordon and Sophie Bostock and Peter Hames and Mhairi Nisbet and Bryony Sheaves and Russell G. Foster and Daniel Freeman and Joan Costa-Font and Richard Emsley and Simon D. Kyle,2016,"Health, Sleep, Insomnia, Digital, CBT, well-being, Function",094 - Digital Cognitive Behavioural Therapy,094,NO,NO,NO,NO,NO,NO,NO,YES,YES,NO,NO,NO,NOT KNOWN,YES,YES,YES,NOT KNOWN,YES,NO,NOT KNOWN,NO,NO,YES,NOT KNOWN,NO,NOT KNOWN,NO,NO,NO,NO,NO,NO,NO,NO,YES,NO,SleepIO,"United Kingdom, Oxford",12-Sleep-wake disorders,12,Sleep-wake disorders,NA,Insomnia,YES,NO,NO,NO,YES,NO,YES,NO,NO,"PARALLEL-GROUP, SUPERIORITY, RCT OF DCBT
(+ TREATMENT AS USUAL, TAU) VERSUS SHE (+TAU).",NA,1000,NA,"randomised controlled trial of 1000 community participants
meeting criteria for insomnia disorder. In the DIALS trial (Digital Insomnia therapy to Assist your Life as well as
your Sleep), participants will be randomised to dCBT delivered using web and/or mobile channels (in addition to
treatment as usual (TAU)) or to sleep hygiene education (SHE), comprising a website plus a downloadable booklet (in
addition to TAU)",NO,NO ASSESSMENT,NO,United Kingdom
