type,title,abstract,journal,author,year,keywords,filename,id,sens_acc,sens_gyr,sens_gps,sens_mic,sens_cam,perv_pill,perv_ecg,perv_wearable,ux_gui,ux_gesture,ux_voice,ux_text,ux_back,media_text,media_image,media_audio,media_video,media_anim,feat_use,feat_promp,feat_soc,feat_hcp,feat_learn,feat_prog,feat_ca,feat_ass,feat_vr,feat_ar,feat_pers,feat_game,anal_ml,anal_beh,anal_act,anal_sp,os_ios,os_and,app_name,geo_loc,md,md_id,md_desc,md_mul,md_sub,fmw_cbt,fmw_hum,fmw_sys,fmw_psy,fmw_wav,fmw_tra,fmw_pos,fmw_other,fmw_nk,val_ed,val_res,val_n,val_n2,val_ec,val_done,val_type,val_edrct,geo_ctry
Article,"Efficacy of PRIME, a mobile app intervention designed to improve motivation in young people with schizophrenia","The onset of schizophrenia occurs during a period critical for development of social relationships and functional independence. As such, interventions that target the early course of illness have the potential to stave off functional decline and restore functioning to pre-illness levels. In this entirely remote study, people with recent-onset schizophrenia spectrum disorders (SSDs) participated in a 12-week randomized controlled trial to determine the efficacy of PRIME (personalized real-time intervention for motivational enhancement), a mobile-based digital health intervention designed to improve motivation and quality of life. Participants were randomized into the PRIME (n = 22) or treatment-as-usual/waitlist (TAU/WL) condition (n = 21) and completed assessments at baseline, post-trial (12 wk), and for people in the PRIME condition, 3 months after the end of the trial. After 12-weeks, WL participants received PRIME, resulting in a total sample of 38 participants completing PRIME. In PRIME, participants worked towards self-identified goals with the support of a virtual community of age-matched peers with schizophrenia-spectrum disorders as well as motivation coaches. Compared to the WL condition, people in the PRIME condition had significantly greater improvements in self-reported depression, defeatist beliefs, self-efficacy, and a trend towards motivation/pleasure negative symptoms post-trial, and these improvements were maintained 3 months after the end of trial. We also found that people in the PRIME condition had significantly greater improvements in components of social motivation post-trial (anticipated pleasure and effort expenditure). Our results suggest that PRIME has the potential to be an effective mobile-based intervention for improving aspects of mood and motivation in young people with SSDs. 2018 OUP. All rights reserved.",Schizophrenia Bulletin,S. Vinogradov,2018,treatment effectiveness,"408 - Efficacy of PRIME, a Mobile App Intervention",408,NA,NA,NA,NA,NA,NA,NA,NA,NA,NA,NA,NA,NA,NOT KNOWN,NOT KNOWN,NA,NA,NA,NA,NA,NA,NA,NA,NOT KNOWN,NA,NA,NA,NA,NA,NA,NA,NA,NA,NA,NOT KNOWN,NOT KNOWN,PRIME,United States of America,2-Schizophrenia spectrum and other psychotic disorders,2,Schizophrenia spectrum and other psychotic disorders,NA,NA,NO,NO,NO,NO,NO,NO,NO,YES,NO,RCT,"Compared to the WL condition, people in the PRIME condition had significantly greater improvements in self-reported depression, defeatist beliefs, self-efficacy, and a trend towards motivation/pleasure negative symptoms post-trial, and these improvements were maintained 3 months after the end of trial. We also found that people in the PRIME condition had significantly greater improvements in components of social motivation post-trial (anticipated pleasure and effort expenditure).",43,NA,Intervention group (N=22) and Waiting list control (N=21),YES,EFFECT AND USABILITY/UX,RCT,United States of America
Article,Evaluating the feasibility and effectiveness of an australian safety planning smartphone application: A pilot study within a tertiary mental health service,"Objective The purpose of this study was to examine the feasibility and effectiveness of a suicide prevention smartphone application. Method Thirty-six non-Aboriginal Australians aged between 16 and 42 years (67\% female) were recruited from a tertiary mental health service where they were receiving treatment for suicide risk. Participants were asked to use the BeyondNow safety planning smartphone application to manage their suicide safety plan during a 2-month trial, as an adjunct to treatment as usual. A survey battery designed to measure feasibility and effectiveness of the smartphone app plus treatment as usual intervention was completed at baseline and follow-up. Results A vast majority of participants used the app to view and edit their safety plans and reported that the app was easy to use. A reduction was observed in participant severity and intensity of suicide ideation, and suicide-related coping increased significantly. No significant changes were observed in suicide resilience. Conclusions The BeyondNow safety planning smartphone application was shown to be feasible and effective as an adjunct to mental health treatment among patients at risk of suicide. (PsycINFO Database Record (c) 2019 APA, all rights reserved)",Suicide and Life-Threatening Behavior,Barbara Stanley,2018,Smartphones,409 - Evaluating the Feasibility and Effectiveness,409,NA,NA,NA,NA,NA,NA,NA,NA,NA,NA,NA,NA,NA,NA,NA,NA,NA,NA,NA,NA,NA,NA,NA,NA,NA,NA,NA,NA,NA,NA,NA,NA,NA,NA,NA,NA,BeyondNow,Australia,25-Suicidal behavior disorder/nonsuicidal self-injury,25,Suicidal behavior disorder/nonsuicidal self-injury,NA,NA,NO,NO,NO,NO,NO,NO,NO,NO,YES,OPEN-LABEL SINGLE-GROUP TRIAL (PILOT STUDY),"A vast majority of participants used the app to view and edit their safety plans and reported that the app was easy to use. A reduction was observed in participant severity and intensity of suicide ideation, and suicide-related coping increased significantly. No significant changes were observed in suicide resilience.",36,NA,"Only experimental group. BeyondNow app, as an adjunct to existing interventions at the tertiary mental health service",YES,EFFECT AND USABILITY/UX,NO,Australia
Article,Formative work in the development of a physical activity smartphone app targeted for patients with alcohol use disorders,"OBJECTIVES: Alcohol use disorders (AUDs) are associated with significant physical and mental health concerns. Interventions focused on increasing physical activity (PA) in this population may improve overall physical and mental health associated with AUDs. Given how ubiquitous smartphones have become, PA apps may be a feasible, acceptable, and potentially scalable approach to integrating PA in alcohol recovery. To date, there are no PA apps targeted specifically for this population. DESIGN: The current study describes 2 formative phases in the development of Fit\&Sober, a theory-informed smartphone app designed to increase PA in patients with alcohol dependence. METHODS: Phase 1 consisted of questionnaires and focus groups (3 groups with total N/=/23) conducted with patients in current AUD treatment regarding their preferences and feedback on the proposed app design and components. Phase 2 consisted of individual usability sessions (N/=/10) conducted with a different set of patients with AUD, in which feedback was provided on the look, usability, and functionality of the Fit\&Sober app prototype. RESULTS: Phase 1 evaluated key components of a physical activity app designed especially for increasing PA in early recovery and refined app features such as the logo, graphical display of data, and specific physical activity-relevant affect words to be used in the app. Phase 2 usability studies provided support for usability, attractiveness, and potential usefulness in the target population. CONCLUSIONS: Through the iterative 2-phase process, a prototype of the Fit\&Sober app was created and readied for pilot testing in patients with AUD. (PsycINFO Database Record (c) 2019 APA, all rights reserved)",Psychology of Sport and Exercise,Michael Stein,2018,Smartphones,411 - Formative work in the development of a physical,411,NOT KNOWN,NOT KNOWN,NOT KNOWN,NOT KNOWN,NOT KNOWN,NO,NO,NO,YES,NO,NO,NO,YES,YES,NO,NOT KNOWN,NO,NO,YES,NOT KNOWN,NO,NO,NOT KNOWN,YES,NO,NO,NO,NO,NO,NO,NOT KNOWN,NOT KNOWN,YES,NA,NOT KNOWN,NOT KNOWN,Fit&Sobber,United States of America,16-Substance-related and addictive disorders,16,Substance-related and addictive disorders,NA,Alcohol,NO,NO,NO,NO,NO,NO,NO,YES,NO,USABILITY STUDY,NA,23,NA,2,NA,NO ASSESSMENT,NO,United States of America
Article,Kickit: The development of an evidence-based smoking cessation smartphone app,"Currently, the evidence for mobile health (mHealth) smoking cessation interventions is limited and heterogeneous, warranting the need for innovative rigorously developed solutions. The aim of this study was to describe the development of a smoking cessation smartphone application (app) developed using evidence-based principles. The app (Kick.it) was designed using the Intervention Mapping framework, incorporating an extensive literature review and qualitative study, in combination with the Behavioural Change Taxonomy v1, the Theoretical Domains Framework, and the Persuasive System Design framework. Kick. it provides quit smoking education, skills training, motivational content and self-regulation functionality for smokers, as well as their social support network. By logging cravings and cigarettes smoked, users will create their own smoking profile, which will be used to provide tailored interventions. It hosts a social network to allow 24/7 social support and provides in-app tools to help with urges to smoke. The app aims to motivate smokers to retry if they slip-up or relapse, allowing them to learn from previous smoking cessation attempts. Rather than basing the app on a singular behavioral change approach, Kick.it will use elements stemming from a variety of behavioral approaches by combining methods of multiple psychological theories. The use of best-practice intervention development frameworks in conjunction with evidence-based behavioral change techniques is expected to result in a smartphone app that has an optimal chance of helping people to quit smoking. (PsycINFO Database Record (c) 2019 APA, all rights reserved)",Translational Behavioral Medicine,Brian J. Smith,2018,tailoring,413 - Kickit The development of an,413,NOT KNOWN,NOT KNOWN,YES,NOT KNOWN,NOT KNOWN,NO,NO,NO,YES,NO,NO,NO,NOT KNOWN,YES,YES,NOT KNOWN,NOT KNOWN,NOT KNOWN,YES,YES,YES,NO,YES,YES,NOT KNOWN,NOT KNOWN,NO,NO,YES,NO,NO,NO,NO,NA,NOT KNOWN,NOT KNOWN,Kick.it,Australia,16-Substance-related and addictive disorders,16,Substance-related and addictive disorders,NA,smoking cessation,YES,NO,NO,NO,NO,NO,NO,YES,NO,"UNKOWN/NO VALUE (IS A SYSTEM DESCRIPTION, WITHOUT DATA)",The use of best-practice intervention development frameworks in conjunction with evidence-based behavioral change techniques is expected to result in a smartphone app that has an optimal chance of helping people to quit smoking,NA,NA,NA,NO,NO ASSESSMENT,NO,Australia
Article,Mobile health (mHealth) versus clinic-based group intervention for people with serious mental illness: A randomized controlled trial,"Objective: mHealth approaches that use mobile phones to deliver interventions can help improve access to care for people with serious mental illness. The goal was to evaluate how mHealth performs against more traditional treatment. Methods: A three-month randomized controlled trial was conducted of a smartphone-delivered intervention (FOCUS) versus a clinic-based group intervention (Wellness Recovery Action Plan [WRAP]). Participants were 163 clients, mostly from racial minority groups and with long-term, serious mental illness (schizophrenia or schizoaffective disorder, 49\%; bipolar disorder, 28\%; and major depressive disorder, 23\%). Outcomes were engagement throughout the intervention; satisfaction posttreatment (three months); and improvement in clinical symptoms, recovery, and quality of life (assessed at baseline, posttreatment, and six months). Results: Participants assigned to FOCUS were more likely than those assigned to WRAP to commence treatment (90\% versus 58\%) and remain fully engaged in eight weeks of care (56\% versus 40\%). Satisfaction ratings were comparably high for both interventions. Participants in both groups improved significantly and did not differ in clinical outcomes, including general psychopathology and depression. Significant improvements in recovery were seen for the WRAP group posttreatment, and significant improvements in recovery and quality of life were seen for the FOCUS group at six months. Conclusions: Both interventions produced significant gains among clients with serious and persistent mental illnesses who were mostly from racial minority groups. The mHealth intervention showed superior patient engagement and produced patient satisfaction and clinical and recovery outcomes that were comparable to those from a widely used clinic-based group intervention for illness management.",Psychiatric Services,E.A. Scherer,2018,NA,414 - Mobile Health (mHealth) Versus,414,NO,NO,NO,NO,NO,NO,NO,NO,YES,NO,NO,NO,NOT KNOWN,YES,NOT KNOWN,NOT KNOWN,NOT KNOWN,NOT KNOWN,NO,NOT KNOWN,NO,NO,YES,NOT KNOWN,NO,YES,NO,NO,NO,NO,NO,NO,NO,NO,NO,YES,FOCUS,United States of America,24-Various disorders,24,Various disorders,"schizophrenia or schizoaffective disorder, bipolar disorder, and major depressive disorder",NA,YES,NO,NO,NO,NO,NO,NO,NO,NO,RCT,"Participants assigned to FOCUS were more likely than those assigned to WRAP to commence treatment (90% versus 58%) and remain fully engaged in eight weeks of care (56% versus 40%). Satisfaction ratings were comparably high for both interventions. Participants in both groups improved significantly and did not differ in clinical outcomes, including general psychopathology and depression. Significant improvements in recovery were seen for the WRAP group posttreatment, and significant improvements in recovery and quality of life were seen for the FOCUS group at six months.",163,NA,"Wellness Recovery Action Plan and FOCUS (a multimodal, smarphone-delivered intervention)",YES,EFFECT AND USABILITY/UX,RCT,United States of America
Article,Reducing distress and improving social functioning in daily life in people with auditory verbal hallucinations: Study protocol for the Temstem' randomised controlled trial,"Introduction Auditory verbal hallucinations (AVH) are prevalent experiences that can induce distress and impede social functioning. While most voice hearers benefit from antipsychotic medication or cognitive-behavioural therapy, additional effective interventions are needed to reduce the burden of experiencing AVH. Temstem' is an easily accessible and useable smartphone application that was developed by designers in close cooperation with voice hearers and experts. By using language games, Temstem aims to reduce distress and improve social functioning. Methods This is a single-blind multicentre randomised controlled trial with two arms: Temstem+AVH monitoring' versus AVH monitoring' (total n=100). Participants are adult patients who suffer daily from AVH and will be recruited in outpatient units. Primary assessment in daily life is made by the Experience Sampling Method (ESM) and daily monitoring with the PsyMate app. During an ESM period of 6 days, participants assess their mental state (including AVH and context) several times a day by filling in short questionnaires. There are three 6-day ESM periods: at baseline (week 0-1), post-treatment (weeks 5-6) and follow-up (weeks 9-10). In addition, during the entire 10-week study period, all participants monitor their AVH two times a day with a short assessment via the PsyMate app. Participants in the Temstem+AVH monitoring condition are provided with the Temstem app from week 1 to 6. Other assessments made at baseline, post-treatment and follow-up are based on questionnaires and a clinical interview. Ethics and dissemination The results from this study will provide an evaluation of the effectiveness of Temstem, a non-invasive and easily accessible app for voice hearers, and insight into the determinants of optimal use. Results will be disseminated unreservedly, irrespective of the magnitude or direction of the effects. This study protocol was approved by the Medical Ethics Committee of the VU University Medical Centre (METC number: 2015.435/NL53684.029.15). Trial registration number ISRCTN75717636; Pre-results. 2018 Article author(s) (or their employer(s) unless otherwise stated in the text of the article). All rights reserved.",BMJ Open,D. {Van Den Berg},2018,Experience Sampling,418 - Reducing distress and improving social,418,NO,NO,NO,NOT KNOWN,NO,NO,NO,NO,YES,NO,NOT KNOWN,NO,NO,YES,NOT KNOWN,YES,NOT KNOWN,NOT KNOWN,NO,NO,NO,NO,YES,NO,NO,NO,NO,NO,NO,YES,NOT KNOWN,NOT KNOWN,NOT KNOWN,NOT KNOWN,YES,YES,Temstem,The Netherlands,2-Schizophrenia spectrum and other psychotic disorders,2,Schizophrenia spectrum and other psychotic disorders,NA,NA,NO,NO,NO,NO,NO,NO,NO,NO,YES,STUDY PROTOCOL FOR RCT,"No results, study protocol",NA,NA,single-blind multicentre RCT with two arms: ‘Temstem+AVH monitoring’ versus ‘AVH monitoring’.,NO,NO ASSESSMENT,PROTOCOL OF  RCT,The Netherlands
Article,Smartphone-based ecological momentary assessment and intervention in a blended coping-focused therapy for distressing voices: Development and case illustration,"Common approaches to the psychological treatment of distressing voice hearing experiences, such as cognitive behavioural therapy, aim to promote more adaptive cognitive, emotional and behavioural responses to these experiences. Digital technologies such as smartphones show promise for supporting and enhancing these treatments by linking immediate therapeutic settings to the context of daily life. Two promising technologies include ecological momentary assessment and intervention (EMA/I), which may offer a means of advanced assessment and support in daily life, and inform the tailoring of interventions to suit individual needs. In this study, a highly novel intervention approach was developed involving four face-to-face sessions with a psychologist blended with EMA/I between sessions in order to improve coping with distressing voice hearing experiences. The authors describe the background and development of this approach along-side a single case illustration, which supported feasibility and acceptability. This study details how digital technologies such as EMA/I may be used in future as clinical tools to enhance standard psychological treatments and clinical care of people with persisting and distressing experiences.",Internet Interventions-the Application of Information Technology in Mental and Behavioural Health,Neil Thomas,2018,NA,419 - Smartphone-based ecological momentary assessment,419,NOT KNOWN,NOT KNOWN,NOT KNOWN,NO,NO,NO,NO,NO,YES,NO,NO,NO,YES,YES,YES,NOT KNOWN,NOT KNOWN,NOT KNOWN,NO,YES,NO,YES,YES,NO,NOT KNOWN,YES,NO,NO,YES,NO,NO,NO,NO,NO,YES,YES,RealLife Exp,Australia,2-Schizophrenia spectrum and other psychotic disorders,2,Schizophrenia spectrum and other psychotic disorders,NA,NA,YES,NO,NO,NO,NO,NO,NO,NO,NO,CASE REPORTS,"Harry reported improvements
to his awareness of different and more effective coping responses for his
voices. Clinical measures completed following the intervention showed
Harry had increased the level of confidence in coping with the voices
from 5/10 to 8/10. The final assessment coincided with some external
stressors which he attributed to an increase in the severity of his voices,
which was evident on the increased PSYRATS-AH overall voice severity
score, though this was not clinically significant (pre: 17, post: 23). There
was a reduction in the SEPS negative impact of the voices (pre: 95, post:
87), though this change was not clinically significant, and there was no
change in DASS-21 negative emotional symptoms (pre: 66, post: 66).",1,NA,NA,YES,EFFECT AND USABILITY/UX,NO,Australia
Article,Smartphone-based ecological momentary assessment and intervention in a coping-focused intervention for hearing voices (SAVVy): Study protocol for a pilot randomised controlled trial,"Background: Smartphone-based ecological momentary assessment and intervention (EMA/I) show promise for enhancing psychological treatments for psychosis. EMA has the potential to improve assessment and formulation of experiences which fluctuate day-to-day, and EMI may be used to prompt use of therapeutic strategies in daily life. The current study is an examination of these capabilities in the context of a brief, coping-focused intervention for distressing voice hearing experiences. Methods/design: This is a rater-blinded, pilot randomised controlled trial comparing a four-session intervention in conjunction with use of smartphone EMA/I between sessions, versus treatment-as-usual. The recruitment target is 34 participants with persisting and distressing voice hearing experiences, recruited through a Voices Clinic based in Melbourne, Australia, and via wider advertising. Allocation will be made using minimisation procedure, balancing of the frequency of voices between groups. Assessments are completed at baseline and 8 weeks post-baseline. The primary outcomes of this trial will focus on feasibility and acceptability of the intervention and trial methodology, with secondary outcomes examining preliminary clinical effects related to overall voice severity, the emotional and functional impact of the voices, and emotional distress. Discussion: This study offers a highly novel examination of specific smartphone capabilities and their integration with traditional psychological treatment for distressing voices. Such technology has potential to enhance psychological interventions and promote adaptation to distressing experiences. 2018 The Author(s).",Trials,N. Thomas,2018,Auditory hallucinations,420 - Smartphone-based ecological momentary assessment and intervention in a coping,420,NO,NO,YES,NO,NO,NO,NO,NO,YES,NO,NO,NO,YES,YES,NO,NO,NO,NO,NO,YES,NO,YES,NO,NO,NOT KNOWN,YES,NO,NO,YES,NO,NO,NO,NO,NOT KNOWN,NO,YES,movisenseXS,Australia,2-Schizophrenia spectrum and other psychotic disorders,2,Schizophrenia spectrum and other psychotic disorders,Yes,NA,YES,NO,NO,NO,NO,NO,NO,NO,NO,PILOT RANDOMISED CONTROLLED TRIAL,NA,34,NA,"comparing a four-session intervention in
conjunction with use of smartphone EMA/I between sessions, versus treatment-as-usual",NO,NO ASSESSMENT,NO,Australia
InProceedings,SocioEmpathy: A social-sensitivity application to reduce stress and depression of divorce or domestic violence victims,"Divorce rate in Indonesia is the highest in the Asia Pacific. Meanwhile, the effects of divorce and domestic violence are so bad for children, especially for teenagers. The children of the divorce will show more anxiety, depression, and antisocial behavior than the child of a normal family. On the other side, the most important thing for people who are depressed is the presence of people who are willing to listen to them patiently and to not to underestimate the problem. However, depressed people don't always find people who are willing to do so when they are depressed. Thus, an application to facilitate them to share their stories and problems is needed, it is called SocioEmpathy. Methodology to develop SocioEmpathy is literature study based on scientific journals and books on ICT, and unstructured interviews towards divorce victim and professional psychologist. The result is a SocioEmpathy application that has features: 1) Timeline, 2) Personal Chat, 3) Panic Button, 4) Mood Tracker, and 5) Psychologist Consultation. The conclusion of this research is SocioEmpathy is expected to become a solution for divorce victims to ease their depression. On the other hand, the SocioEmpathy app also increase experience for psychology students and psychologists involved in this application. 2018 IEEE.",NA,Arga Putra Panatagama and Guntur Putra Pratama and Dwi Yog Wibawa,2018,Smart society,421 - SocioEmpathy A Social-Sensitivity Application,421,NO,NO,NO,NO,NO,NO,NO,NO,YES,NO,NO,NO,NO,YES,YES,NOT KNOWN,NOT KNOWN,NO,YES,YES,YES,YES,NO,YES,NO,NO,NO,NO,NO,NO,NO,NO,NO,NOT KNOWN,NOT KNOWN,YES,SocioEmpathy,Indonesia,4-Depressive disorders,4,Depressive disorders,NA,NA,NO,NO,NO,NO,NO,NO,NO,NO,YES,"CASE REPORTS ? NO IDENTIFICO BIEN EL DISEÑO, LO QUE HACEN ES ENTREVISTAS: UNSTRUCTURED INTERVIEWS TOWARDS DIVORCE VICTIM AND PROFESSIONAL PSYCHOLOGIST PARA VER SUS NECESIDADES. TAMBIÉN ESTUIDAN LA USABILIDAD VALORADA POR 1 PARTICIPANTE","SocioEmpathy is expected to become a solution for divorce victims to ease their depression. On the other hand, the SocioEmpathy app also increase experience for psychology students and psychologists involved in this application",3,3 ( a dos les hacen la entrevista) a 1 el test de usabilidad,NA,YES,USABILITY/UX,NO,Indonesia
