type,title,abstract,journal,author,year,keywords,filename,id,sens_acc,sens_gyr,sens_gps,sens_mic,sens_cam,perv_pill,perv_ecg,perv_wearable,ux_gui,ux_gesture,ux_voice,ux_text,ux_back,media_text,media_image,media_audio,media_video,media_anim,feat_use,feat_promp,feat_soc,feat_hcp,feat_learn,feat_prog,feat_ca,feat_ass,feat_vr,feat_ar,feat_pers,feat_game,anal_ml,anal_beh,anal_act,anal_sp,os_ios,os_and,app_name,geo_loc,md,md_id,md_desc,md_mul,md_sub,fmw_cbt,fmw_hum,fmw_sys,fmw_psy,fmw_wav,fmw_tra,fmw_pos,fmw_other,fmw_nk,val_ed,val_res,val_n,val_n2,val_ec,val_done,val_type,val_edrct,geo_ctry
Article,A Guided Online and Mobile Self-Help Program for Individuals With Eating Disorders: An Iterative Engagement and Usability Study,"BACKGROUND: Numerous digital health interventions have been developed for mental health promotion and intervention, including eating disorders. Efficacy of many interventions has been evaluated, yet knowledge about reasons for dropout and poor adherence is scarce. Most digital health intervention studies lack appropriate research design and methods to investigate individual engagement issues. User engagement and program usability are inextricably linked, making usability studies vital in understanding and improving engagement. OBJECTIVE: The aim of this study was to explore engagement and corresponding usability issues of the Healthy Body Image Program-a guided online intervention for individuals with body image concerns or eating disorders. The secondary aim was to demonstrate the value of usability research in order to investigate engagement. METHODS: We conducted an iterative usability study based on a mixed-methods approach, combining cognitive and semistructured interviews as well as questionnaires, prior to program launch. Two separate rounds of usability studies were completed, testing a total of 9 potential users. Thematic analysis and descriptive statistics were used to analyze the think-aloud tasks, interviews, and questionnaires. RESULTS: Participants were satisfied with the overall usability of the program. The average usability score was 77.5/100 for the first test round and improved to 83.1/100 after applying modifications for the second iteration. The analysis of the qualitative data revealed five central themes: layout, navigation, content, support, and engagement conditions. The first three themes highlight usability aspects of the program, while the latter two highlight engagement issues. An easy-to-use format, clear wording, the nature of guidance, and opportunity for interactivity were important issues related to usability. The coach support, time investment, and severity of users' symptoms, the program's features and effectiveness, trust, anonymity, and affordability were relevant to engagement. CONCLUSIONS: This study identified salient usability and engagement features associated with participant motivation to use the Healthy Body Image Program and ultimately helped improve the program prior to its implementation. This research demonstrates that improvements in usability and engagement can be achieved by testing and adjusting intervention design and content prior to program launch. The results are consistent with related research and reinforce the need for further research to identify usage patterns and effective means for reducing dropout. Digital health research should include usability studies prior to efficacy trials to help create more user-friendly programs that have a higher likelihood of {""}real-world{""} adoption.",Journal of medical Internet research,M. Nitsch and C.N. Dimopoulos and E. Flaschberger and K. Saffran and J.F. Kruger and L. Garlock and D.E. Wilfley and C.B. Taylor and M. Jones,2016,"human, mobile application, telemedicine, questionnaire, Internet, Telemedicine, psychology, interview, Humans, Surveys and Questionnaires, procedures, Mobile Applications, self care, motivation, Motivation, health promotion, Health Promotion, Self Care, Interviews as Topic, Feeding and Eating Disorders, body image, Body Image",007 - A Guided Online and Mobile Self-Help,007,NO,NO,NO,NO,NO,NO,NO,NO,YES,NO,NO,NO,NOT KNOWN,YES,YES,YES,NOT KNOWN,NOT KNOWN,YES,NO,YES,YES,YES,YES,NO,YES,NO,NO,YES,NO,NO,NO,NO,NO,NO,NO,Student Bodies–Eating Disorders (SB-ED),"United States of America, San Francisco",10-Feeding and eating disorders,10,Feeding and eating disorders,NA,NA,YES,NO,NO,NO,NO,NO,NO,YES,NO,ITERATIVE USABILITY STUDY,"Participants were satisfied with the overall usability of the program. The average usability score was 77.5/100 for the
first test round and improved to 83.1/100 after applying modifications for the second iteration. The analysis of the qualitative data revealed five central themes: layout, navigation, content, support, and engagement conditions. The first three themes highlight usability aspects of the program, while the latter two highlight engagement issues. An easy-to-use format, clear wording, the nature of guidance, and opportunity for interactivity were important issues related to usability. The coach support, time investment, and severity of users’ symptoms, the program’s features and effectiveness, trust, anonymity, and affordability were relevant to engagement.",9,NA,Intervention condition (experimental); There is not any control group.,YES,USABILITY/UX,NO,United States of America
Article,A pilot study of the acceptability and usability of a smartphone application intervention for suicidal adolescents and their parents.,"Interconnectedness through technology presents both challenges and opportunities for suicide prevention and intervention with adolescents and families. The time following discharge from acute care facilities represents a critical period of suicide risk for adolescents, which could be buffered by a technological intervention they could use post-discharge. Crisis Care is a smartphone application intervention developed specifically for suicidal adolescents and their parents to use during this period of increased risk. A web-based prototype of Crisis Care was pilot tested with 20 adolescent-parent dyads. Results demonstrated acceptability and usability, suggesting the utility of technological interventions, such as Crisis Care, as an adjunct to treatment for suicidal adolescents and their parents following discharge from acute care settings. (PsycINFO Database Record (c) 2017 APA, all rights reserved)",Archives of Suicide Research,Kimberly H. McManama O'Brien and Mary LeCloux and Abigail Ross and Christina Gironda and Elizabeth A. Wharff,2017,"Parents, *At Risk Populations, *Intervention, *Psychiatric Hospital Discharge, *Suicide Prevention, *Telemedicine, Adolescent Characteristics, Adolescent Psychopathology, Cellular Phones, Human Factors Engineering",012 - A Pilot Study of the Acceptability,012,NO,NO,NO,NO,NO,NO,NO,NO,YES,NO,NO,NO,NOT KNOWN,YES,YES,YES,YES,NOT KNOWN,YES,NOT KNOWN,NO,YES,YES,NOT KNOWN,NO,NOT KNOWN,NO,NO,YES,NO,NO,NO,NO,NO,NO,NO,NA,United States of America,25-Suicidal behavior disorder/nonsuicidal self-injury,25,Suicidal behavior disorder/nonsuicidal self-injury,NA,Suicide,YES,NO,NO,NO,NO,NO,YES,NO,NO,PILOT STUDY,"Results demonstrated acceptability and usability, suggesting the utility of technological interventions, such as Crisis Care, as an adjunct to treatment for suicidal adolescents and their parents following discharge from acute care settings.",20,20 parent-adolescent dyads,Intervention condition (experimental); There is not any control group.,YES,USABILITY/UX,NO,United States of America
Article,A Pilot Study to Examine the Feasibility and Potential Effectiveness of Using Smartphones to Provide Recovery Support for Adolescents,"Smartphone applications can potentially provide recovery monitoring and support in real-time, real-life contexts. Study aims included determining feasibility of (a) adolescents completing ecological momentary assessments (EMAs) and utilizing phone-based ecological momentary interventions (EMIs); and (b) using EMA and EMI data to predict substance use in the subsequent week. Methods: Twenty-nine adolescents were recruited at discharge from residential treatment, regardless of their discharge status or length of stay. During the 6-week pilot, youth were prompted to complete an EMA at 6 random times per day and were provided access to a suite of recovery support EMI. Youth completed 87\% of the 5580 EMAs. Based on use in the next 7 days, EMA observations were classified into 3 risk groups: {""}Current Use{""} in the past 30 minutes (3\% of observations), {""}Unrecognized Risk{""} (42\%), or {""}Recognized Risk{""} (55\%). All youth had observations in 2 or more risk groups and 38\% in all 3. Youth accessed an EMI on average 162 times each week. Results: Participants were 31\% female, 48\% African American, 21\% Caucasian, 7\% Hispanic, and 24\% Mixed/Other; average age was 16.6 years. During the 90 days prior to entering treatment, youth reported using alcohol (38\%), marijuana (41\%), and other drugs (7\%). When compared with the {""}Recognized Risk{""} group's use in the following week (31\%), both the {""}Unrecognized Risk{""} (50\%, odds ratio [OR] = 2.08) and {""}Current Use{""} (96\%, OR = 50.30) groups reported significantly higher rates of use in the next week. When an EMI was accessed 2 or more times within the hour following an EMA, the rate of using during the next week was significantly lower than when EMIs were not accessed (32\% vs. 43\%, OR = 0.62). Conclusions: Results demonstrate the feasibility of using smartphones for recovery monitoring and support with adolescents, with potential to reduce use. 2015 Taylor and Francis Group, LLC.",Substance Abuse,M.L. Dennis and C.K. Scott and R.R. Funk and L. Nicholson,2015,"female, human, male, mobile application, pilot study, ecological momentary assessment, feasibility study, adolescent, Adolescent, Female, Humans, Male, procedures, smartphone, Mobile Applications, Pilot Projects, Feasibility Studies, Computer-Assisted, computer assisted therapy, Therapy, Smartphone, Substance-Related Disorders, Ecological Momentary Assessment",013 - A Pilot Study to Examine the Feasibility and Potential,013,NOT KNOWN,NOT KNOWN,NOT KNOWN,NOT KNOWN,NOT KNOWN,NO,NO,NO,YES,NOT KNOWN,NOT KNOWN,NOT KNOWN,NOT KNOWN,YES,YES,YES,YES,NOT KNOWN,NOT KNOWN,NOT KNOWN,YES,NOT KNOWN,YES,YES,NOT KNOWN,YES,NOT KNOWN,NOT KNOWN,NOT KNOWN,YES,NOT KNOWN,NOT KNOWN,NOT KNOWN,NOT KNOWN,YES,YES,A-CHESS,United States of America,16-Substance-related and addictive disorders,16,Substance-related and addictive disorders,NA,Alcohol; marijuana; other drugs,YES,NO,NO,NO,NO,NO,NO,YES,NO,PILOT STUDY,"When compared to the “Recognized Risk” group’s use in the following week (31%), both the “Unrecognized Risk” (50%, OR=2.08) and “Current Use” (96%, OR=50.30) groups reported significantly higher rates of use in the next week. When an EMI was accessed 2 or more times within the hour following an EMA, the rate of using during the next week was significantly lower than when EMIs were not accessed (32% vs. 43%, OR=0.62).",29,NA,Intervention condition (experimental); There is not any control group.,YES,EFFECT AND USABILITY/UX,NO,United States of America
Article,A randomized controlled study of exposure therapy as aftercare for alcohol use disorder: Study protocol,"Background: It is well documented that individuals with Alcohol Use Disorder (AUD) respond well during evidence-based psychological treatment, but also that a large proportion relapses when discharged from treatment and confronted with alcohol in real life. Cue Exposure Treatment (CET) focuses on exposing individuals to alcohol cues in order to reduce cravings as well as the likelihood of relapse. The aims of the study are: 1) to investigate whether CET aftercare delivered via a smartphone or in group sessions increases the effect of Cognitive Behavioural Treatment in groups of alcohol dependent individuals; 2) to investigate whether CET as a smartphone application is as or more effective than CET group therapy, and 3) to investigate whether CET as a smartphone application is more cost-effective than CET group aftercare and Aftercare as Usual. Design and methods: The study will be implemented as an investigator-blinded randomized controlled trial. A total of 300 consecutively enrolled alcohol use disorder individuals recruited from an alcohol outpatient clinic will be randomized into one of the three following aftercare groups after concluding primary treatment: (1) CET as a smartphone application; (2) CET as group therapy, and (3) Aftercare as Usual. It is hypothesized that the two experimental groups will achieve better treatment outcomes compared to the control group (3). Discussion: Individuals in the CET groups are given the opportunity to practise coping strategies during exposure to alcohol stimuli before being unavoidably confronted with alcohol and associated stimuli in real life. Thus, CET may help prevent patients from relapsing after concluding treatment, and in the long term. Moreover, the CET application has the potential to improve AUD treatment and continuing care by offering psychological treatment whenever and wherever the patient finds it convenient. Trial registration: ClinicalTrials.gov ID: NCT02298751Registration date: 6 November 2014. 2016 Mellentin et al.",BMC Psychiatry,A.I. Mellentin and B. Nielsen and A.S. Nielsen and F. Yu and E. Stenager,2016,"adult, Article, controlled study, human, mobile application, cost effectiveness analysis, health care delivery, health care planning, randomized controlled trial, major clinical study, treatment duration, craving, disease severity, treatment outcome, psychology, Adult, Humans, cognitive therapy, Cognitive Therapy, procedures, smartphone, Treatment Outcome, alcoholism, alcohol consumption, self concept, Psychological, Adaptation, coping behavior, methodology, Research Design, association, Craving, Cues, aftercare, Aftercare, group therapy, implosive therapy, Implosive Therapy, withdrawal syndrome, alcohol use disorder, Alcohol-Related Disorders, Cue Exposure Treatment",014 - A randomized controlled study of exposure,014,NO,NO,NO,NO,NO,NO,NO,NO,YES,NO,NO,NO,YES,YES,YES,NOT KNOWN,YES,NOT KNOWN,NOT KNOWN,YES,NO,YES,YES,NOT KNOWN,NO,NOT KNOWN,NO,NO,YES,NO,NOT KNOWN,NOT KNOWN,NOT KNOWN,NOT KNOWN,NOT KNOWN,NOT KNOWN,CET Application,Denmark,16-Substance-related and addictive disorders,16,Substance-related and addictive disorders,NA,Alcohol use disorder,YES,NO,NO,NO,NO,NO,NO,NO,NO,RANDOMIZED CONTROLLED TRIAL STUDY PROTOCOL,NA,300,NA,"3  conditions: 1) CET as a smartphone application (exprimental condition, N=100); 2) CET as group therapy (experimental condition, N=100); 3) Aftercare as Usual (control group, N=100).",NO,NO ASSESSMENT,NO,Denmark
Article,A randomized controlled trial of a smartphone app for posttraumatic stress disorder symptoms,"Objective: Posttraumatic stress disorder (PTSD) is highly prevalent in the population, but relatively few affected individuals receive treatment for it. Smartphone applications (apps) could help address this unmet need by offering sound psychoeducational information and evidence-based cognitive behavioral coping tools. We conducted a randomized controlled trial to assess the efficacy of a free, publicly available smartphone app (PTSD Coach) for self-management of PTSD symptoms. Method: One hundred 20 participants who were an average of 39 years old, mostly women (69.2\%) and White (66.7\%), recruited primarily through online advertisements, were randomized to either a PTSD Coach (n = 62) or a waitlist condition (n = 58) for 3 months. Web-administered self-report measures of PTSD, PTSD symptom coping self-efficacy, depression, and psychosocial functioning were conducted at baseline, posttreatment, and 3 months following treatment. Results: Following the intent-to-treat principle, repeated-measures analyses of variance (ANOVAs) revealed that at posttreatment, PTSD Coach participants had significantly greater improvements in PTSD symptoms (p =.035), depression symptoms (p =.005), and psychosocial functioning (p =.007) than did waitlist participants; however, at posttreatment, there were no significant mean differences in outcomes between conditions. A greater proportion of PTSD Coach participants achieved clinically significant PTSD symptom improvement (p =.018) than waitlist participants. Conclusion: PTSD Coach use resulted in significantly greater improvements in PTSD symptoms and other outcomes relative to a waitlist condition. Given the ubiquity of smartphones, PTSD Coach may provide a wide-reaching, convenient public health intervention for individuals with PTSD symptoms who are not receiving care. 2017 American Psychological Association.",Journal of Consulting and Clinical Psychology,E. Kuhn and N. Kanuri and J.E. Hoffman and D.W. Garvert and J.I. Ruzek and C.B. Taylor,2017,"adult, Article, clinical effectiveness, controlled study, depression, female, human, male, mobile application, self report, randomized controlled trial, major clinical study, disease severity, psychology, Caucasian, Adult, Female, Humans, Male, cognitive therapy, Cognitive Therapy, procedures, smartphone, Mobile Applications, patient education, Patient Education as Topic, self care, advertising, self concept, Psychological, Adaptation, coping behavior, Self Care, Smartphone, posttraumatic stress disorder, Post-Traumatic, Stress Disorders, social psychology",015 - A randomized controlled trial of a smartphone,015,NO,NO,NO,NO,NO,NO,NO,NO,YES,NO,NO,NO,NOT KNOWN,YES,YES,YES,NA,NOT KNOWN,NO,YES,NOT KNOWN,YES,YES,YES,NO,YES,NO,NO,YES,NO,NO,NO,NO,NO,YES,YES,PTSD Coach,"United States of America, California",7-Trauma and stressor-related disorders,7,Trauma and stressor-related disorders,NA,NA,YES,NO,NO,NO,NO,NO,NO,NO,NO,RANDOMIZED CONTROLLED TRIAL,"Following the intent-to-treat principle, repeated-measures analyses of variance (ANOVAs) revealed that at posttreatment, PTSD Coach participants
had significantly greater improvements in PTSD symptoms (p < .035), depression symptoms (p <.005), and psychosocial functioning (p < .007) than did waitlist participants; however, at posttreatment, there were no significant mean differences in outcomes between conditions. A greater proportion of
PTSD Coach participants achieved clinically significant PTSD symptom improvement (p < .018) than waitlist participants.",120,NA,"2 conditions: 1) PTSD app Coach (experimental condition; N=62), 2) waitlist condition (control condition, N=58)",YES,EFFECT,RCT,United States of America
Article,A Scenario-Based Cognitive Behavioral Therapy Mobile App to Reduce Dysfunctional Beliefs in Individuals with Depression: A Randomized Controlled Trial.,"INTRODUCTION: While self-administered mobile app-based cognitive behavioral therapy (CBT) has shown efficiency and effectiveness over the past decade, attempts to address automatic and negative beliefs have been lacking. The purpose of this study was to introduce and verify a mobile app that directly intervenes in dysfunctional thoughts. This app-based treatment includes recognizing automatic and negative thoughts of the protagonist of scenarios, writing advice directly to the main character, and sharing advice provided by other participants.; MATERIALS AND METHODS: Thirty-four participants diagnosed with Other Specified Depressive Disorder were recruited and randomly allocated to a CBT-based mobile-app program, the Todac Todac (TT group), or a daily mood chart app program (control group). Participants were asked to use the software for 3 weeks. Assessments for autonomic thoughts and clinical symptoms were administered at baseline and at a follow-up evaluation.; RESULTS: After completing the 3-week program, Dysfunctional Attitude Scale (DAS) scores in TT group were lower than they were in the control group. In clinical measures, both TT group and control group showed reduced Beck Depression Inventory-II (BDI-II) scores and situation-dependent trait version of State-Trait Anxiety Inventory (STAI-X2) at follow-up. However, TT group showed significantly reduced STAI-X2 scores compared to control group. For all participants, changes in DAS scores were correlated with BDI-II and STAI-X2 scores.; CONCLUSIONS: Our preliminary findings provide promising evidence that scenario-based CBT mobile apps can be used to deliver feasible and efficacious cognitive therapy. Long-term research is needed to determine the impact and effectiveness of this new treatment format.",Telemedicine journal and e-health : the official journal of the American Telemedicine Association,Ji-Won Hur and Boram Kim and Dasom Park and Sung-Won Choi,2018,"cognitive behavioral therapy, depression, telehealth, telepsychiatry, intervention, mobile app, e-health, m-health",020 - A Scenario-Based Cognitive Behavioral Therapy,020,NO,NO,NO,NO,NO,NO,NO,NO,YES,NO,NO,NO,NOT KNOWN,YES,NOT KNOWN,NOT KNOWN,NOT KNOWN,NOT KNOWN,NOT KNOWN,YES,YES,NOT KNOWN,NOT KNOWN,YES,NO,NOT KNOWN,NO,NO,NOT KNOWN,NO,NOT KNOWN,NOT KNOWN,NOT KNOWN,NOT KNOWN,NOT KNOWN,NOT KNOWN,TODAC TODAC,Republic of Korea,4-Depressive disorders,4,Depressive disorders,NA,Other specified depressive disorder (not major depression),YES,NO,NO,NO,NO,NO,NO,NO,NO,RANDOMIZED CONTROLLED TRIAL,"After completing the 3-week program, Dysfunctional
Attitude Scale (DAS) scores in TT group were lower than they
were in the control group. In clinical measures, both TT group
and control group showed reduced Beck Depression Inventory-
II (BDI-II) scores and situation-dependent trait version of
State-Trait Anxiety Inventory (STAI-X2) at follow-up. However,
TT group showed significantly reduced STAI-X2 scores
compared to control group. For all participants, changes in
DAS scores were correlated with BDI-II and STAI-X2 scores.",34,NA,"2 conditions: 1) Pogram TT app (carry out 3 step quiz after one scenario ""identigy cognitive distortions, decatastrophizing and distancing); 2) Control group (complete a daily mood diary)",YES,EFFECT,RCT,Republic of Korea
Article,A Smarter Pathway for Delivering Cue Exposure Therapy? The Design and Development of a Smartphone App Targeting Alcohol Use Disorder,"Background: Although the number of alcohol-related treatments in app stores is proliferating, none of them are based on a psychological framework and supported by empirical evidence. Cue exposure treatment (CET) with urge-specific coping skills (USCS) is often used in Danish treatment settings. It is an evidence-based psychological approach that focuses on promoting â€œconfrontation with alcohol cuesâ€ as a means of reducing urges and the likelihood of relapse. Objective: The objective of this study was to describe the design and development of a CET-based smartphone app; an innovative delivery pathway for treating alcohol use disorder (AUD). Methods: The treatment is based on Monty and coworkers' manual for CET with USCS (2002). It was created by a multidisciplinary team of psychiatrists, psychologists, programmers, and graphic designers as well as patients with AUD. A database was developed for the purpose of registering and monitoring training activities. A final version of the CET app and database was developed after several user tests. Results: The final version of the CET app includes an introduction, 4 sessions featuring USCS, 8 alcohol exposure videos promoting the use of one of the USCS, and a results component providing an overview of training activities and potential progress. Real-time urges are measured before, during, and after exposure to alcohol cues and are registered in the app together with other training activity variables. Data packages are continuously sent in encrypted form to an external database and will be merged with other data (in an internal database) in the future. Conclusions: The CET smartphone app is currently being tested at a large-scale, randomized controlled trial with the aim of clarifying whether it can be classified as an evidence-based treatment solution. The app has the potential to augment the reach of psychological treatment for AUD.",JMIR MHEALTH AND UHEALTH,Angelina Isabella Mellentin and Elsebeth Stenager and Bent Nielsen and Anette Sogaard Nielsen and Fei Yu,2017,"mobile application, smartphone, exposure therapy, alcohol use disorder",021 - A Smarter Pathway for Delivering Cue,021,NO,NO,NO,NO,NO,NO,NO,NO,YES,NO,NO,NO,YES,YES,YES,NOT KNOWN,YES,NOT KNOWN,YES,YES,NO,YES,YES,NOT KNOWN,NO,NOT KNOWN,NO,NO,YES,NO,NOT KNOWN,NOT KNOWN,NOT KNOWN,NOT KNOWN,NOT KNOWN,NOT KNOWN,CET Application,Denmark,16-Substance-related and addictive disorders,16,Substance-related and addictive disorders,NA,Alcohol use disorder,YES,NO,NO,NO,NO,NO,NO,NO,NO,QUALITATIVE STUDY,NA,2,2 patient focus groups (2xn=5),Intervention condition (experimental); There is not any control group.,NO,NO ASSESSMENT,NO,Denmark
